clean_text,label
rt great story of what it s really like to be a camel jockey at the camel races in,0
this car has two registration tags both yellow one for amp one for wth,0
cause i didn t wanna see your bitch ass,1
how ah yardie reach wyoming live at,0
lamashtu has some great orgies but is a total bitch lol p,1
why you worried bout that other hoe cuz that other hoe aint worried bout another hoe,1
yo main bitch that s my side hoe,1
they love me at the place i bring my car to i don t know why spanish men love me sometimes i do look like a guala though lol,0
rt you bitches ain t a,1
rt no shave november aka the month i crush the most pussy let the free muzzy rides begin baby,1
rt must watch bill maher schools pbs host charlie rose over islam s illiberal beliefs,0
i ain t bout to listen to this nigga rap about eating pussy,1
rt bitches is so corny sooooooo corny,1
im sippin hot tea bitch,1
they cry over lost pussy more emotional than a sissy they get out amp front on hoes simple minds amp point brothas like me out,1
n i m so tired of hearing he wouldn t do it for u ol bitch he wouldn t have too my people dont play on my end,1
yo that teacher in baltimore wasn t bullshitin with that bitch lmao,1
its training charlie brown,0
i done been to the top i done sipped the juice and with that being said bird crumbs will never do,0
rt all of a sudden all these bitches like soccer today lol,1
are we bitches,1
gaga is that bitch who probably gives a lapdances,1
rt this bitch possessed by the thot demon,1
y u arguing with that ugly bitch on twitter,1
n dat bitch sound like a man if dats ya grandma fucc yu too,1
oh really fags are gross you aids infected sick fuckers,1
these niggaz bitches hiding behind gangs they ain t in,1
i m trash,0
ghetto bird can t fly away from my hood,0
certainlt not the paddies,0
hillbilly bone bo bone bo bone bone,0
all these hoes fucking but they don t want to seem like a hoe so you gotta hit em on the low,1
bitch u got me fuckked up,1
zelda bitches lol,1
rt i got bitches geekin sneakin cocaina cross the customs,1
damn bitch gotta bootay,1
nick cannon movie a year old bitch in texas was pretending to be and went to high school months,1
pussy,1
charlie crist outlawed hated rediculed and vilified for shaking the president s hand what a country what a democracy,0
rt the shocking true stories behind your favorite classic fairy tales via,0
always thought golden oreos were the same as original oreos but oh my god i just climaxed,0
i love butter by atcq but i d love it more if q tip s hook was just looped for three and a half minutes instead of phife s trash verses,0
all these bitches talk shit that s why bust em in they shit,1
sit in there and shit dnt sing hoe no yess,1
rt projects that wyoming senator mike enzi will defeat democratic challenger charlie hardy,0
rt latest draftexpress mock draft has randle cauley stein young poythress harrison twins amp dakari johnson a,0
lol rt most chicks that go to enon are hoes or reformed hoes,1
just learn d dance nuh cuz u know after carnival we like to pick up months old yardie ting lol,0
these hoes ain t loyal rt naya rivera got married three months after breaking up with big sean,1
a nicca got some crazy head last night,1
ga charlie,0
rt keshawn martin is soooooooooo fucking trash,1
rt gun control talks with gunrunning eric holder on board we r the planet of the apes,0
why are people saying don t let guys treat you like a yellow starburst that s my favorite,0
omer asik so trash on the offensive side of the floor dude real life murky doo doo water,0
the microwave at work is broken so my ghetto ass put a hamburger patty in the toaster to warm it up,1
wiz need to go back to the yeahhhhhhh bitch okkkk wiz,1
rt i like how i found out that you can now edit facebook comments through a trending topic on twitter you think i d hear abo,0
this bitch not tellin me,1
it opened up with some clouds parting and with silk gt can we get a room on the southside of the ghetto,1
charlie im an old lady don t ever say ugly things about ur childrens mom i get it jus dont big hug,0
rt dodging these hoes like,1
obama mocked the special olympics wendy davis mocks the handicapped do ya see a pattern democrats,0
rt and apparently i sound like a country hick perks of being from kentucky,1
damn you directtv blackout the yankee game with a freaking walk off you re killing me satellite douche,0
one of the world s most prominent jihadi forums just got shut down,0
no flex zone hoe,1
best asian massage on the brooklyn park slope top rated spa,0
your girls pussy smells like sour cream and onions,1
rt i hate seeing people with money spend it on stupid shit you don t need tvs amp a shark tank you twat,1
either way both schools are trash,0
rt i was in a kik group once but we called it a party line and old charlie the barber was always hogging the calls,0
it s weird but i miss robertson screwdrivers gt from toque to mickey ten canadianisms via,0
and you know best about the bird moves,0
rt if her pussy got over body counts it s dead pussies only have lives,1
rt these bitches play both sides but get left in the middle,1
rt most of these niggas go broke for these hoes,1
rt charles manson s fiancee will have a difficult time planning their honeymoon charlie can t surf,1
rt instant mashed potatoes are trash,0
no one has even eaten a twinkie in like decades,0
obama s faves muslims black ghetto trash via,1
bitch said i lie too much bitch you ain t worth telling the truth too,1
rt a girl tweeted you might be ghetto if u bring food from outside into the movies no u might be stupid if u pay fo,0
what a ratchet ass bitch bet she felt dumb,1
i love jigg jigg,0
psa reduced fat oreos are waxy and don t soften properly when dunked in milk stay away from them they re unnatural,0
remember when the dude who played young ned followed my youtube channel this was when i actually used my youtube for more than favorites,0
emd hoe,1
money doesn t make me happy one bit money makes me feel more comfortable if anything i can get pussy being dead ass broke tho tbh,1
my mom didn t buy me oreos she doesn t love me,0
rt but cant nobody at yall pep rally out jigg me,0
we dem birds,0
rt getting ready for the annual heart and sole luncheon with,0
rt today did my hair and makeup he always tries to make me look like a monkey,0
carne asada gallo pinto tajadas verde queso frito and a salad with milca,0
rt bitch i m not concerned about you,1
racist tx trash there s no comparison betwn pres obama n gwbush rt poll will show he s supported,0
rt when kanye said mayonnaise colored benz i push miracle whips,0
rt s o to them side hos that know they the side hos we need more of ya,1
rt yanks walk off win,0
video shy glizzy i can t trust myself,0
rt btw hillary is a huge supporter of the law they now admit to lying to all you stupid rubes about she needs to be aske,1
just think if alex won some games that sorry son of a bitch will never win us a game,1
what else do you expect from that nigger lover,1
what u doing bitch boy,1
rt this whole week was trash,0
betta ask round these streets bitch bout jay,1
come out her pussy and go in her ass come out her ass and go in her mouth,1
i miss my monkey,0
rt only retards and dads roll lawful good,0
fresh nigga so you kno i need a clean bitch who kno i m working cuz i wanna see my team rich,1
y give a bitch an inch when she rather have,1
rt because humans aren t delicious ho rt smarter than dogs and your year old child so why eat them,0
i would love to give this bitch some act right juice lol,1
smuggled letter by gaza tunnel digger details suffering under hamas rule via,0
khloee s new backpack that we colored last night,0
these hoes ain t loyal n these niggas ain t either fuck ah bitch get ah bird,1
you re a bitch,1
wow that s a stupid bitch,1
i don t ever expose females like that that s childish bitch nigga shiiii,1
this lady is probably like what the fuck does this bitch listen to,1
acid yellow,0
rt this shit is like minutes away and it s am so clearly i am in desperate need of some pussy bruh so i pull up to this,1
niccas be hating on my nicca jeezy,1
rt i could never mess around with someone else s man like that s just clarifying your self as a side hoe,1
haha shit niggah i wish,1
rt i think it s time to bring out the drunken monkey,0
rt everytime i see nelson agholor make a play i want to puke kid should ve been a gator thanks charlie cheeseburger,0
come back hoe,1
fuck my tight pussy until i m dripping wet,1
all of a sudden craving the hell out of cookies,1
rt i know that s trash,0
i m hooked on monkey phonics,0
time to start listing to il spook,0
you re such a fake bitch i cannot stand you if you read this and wonder if its about you it probably is,1
i laugh oreos and lady gaga on a sunday day,0
and we all fell asleep,0
so is the term wigger if someone chooses to listen to hip hop and act a certain way it s cause of his interests not race,1
my son is and still has issues tying his shoes because he s barefoot all the time in case you wanted to know my hillbilly status,0
fucking hate ghetto girls bruh,1
this deb women at my eye appointment bitch,1
can pornhub just get a gaming stream feature so these dumb bitches can gtfo get on it katie lt,1
lil bitch with enough ass amp amp a future,1
rt in you tweeted that migos were trash care to explain supreme court confirmation hearing,0
not taking franks advice and he ate the yellow snow,0
rt so y all just gone look past the fact that this bitch sucking a dick cause her edges laid i swear hate you bitches,1
u serious bro lol rt am early bird special,0
fuck class gon be a bitch tomorrow,1
all i wanna do is get money and fuck model bitches russell simmons,1
rt hate shit like this bitch can t make a decent meal but can take a hell of a thirst trap,1
rt flappy bird make me just smash my phone into my face,0
you hoes ain t got no real friends cause the shit i be seeing boyyyyyyyy my friends ah burry me ft under oml if i m ever slipping,1
biden was a winner last night yea right like charlie sheen really was a a winner too lol,0
rt rise rhyme on in the am wear your green dance a jig amp sing a lively tune w me,0
rt if you love her hide your bitch so you keep shorty,1
bite me bitch chew on a footer,1
rt bitches see a picture of a couple walking on the stairs together and caption it goals bitch all they doing is going,1
games when im in how good is that,0
best of luck to tino the bambino martinez in miami your legacy is saved lol,0
haha same here bitch is trippin,1
jk i d fuck a dog before i fuck you fish pussy,1
rt every super hero a bitch except iron man peter parker the biggest hoe loser ass nigga no bitches no cribs no whips,1
school schoo scho sch sc s st sta stay stay h stay ho stay hom stay home,0
you can bet valerie jarret has her hands all over this humanitarian crisis i didn t vote for that commie bitch,1
rt charlie crist wins democratic primary,0
rt my dick is called batman because bitches love it when my dark knight rises,1
rt one scout said prado is first team most underrated gives the yankees a b through could slide to b if needed too,0
best asian massage on the park slope top rated spa,0
niggas really be dickin over these hoes ona gram thats the reason they got the big head now,1
that s how rednecks erecycle,1
fairy tale world lmao,0
i just need the yankees to win the pennant,0
rt this the i play soccer cheat on girls and wear khaki coloured cargos haircut,0
rt oreo cheesecake bites,0
if you ain t ma bro you better watch yo bitch borrow yo hoe introduce ma pimp,1
pinche panamonos negros me dan asco,0
rt retweet for big booty bitches,1
yanks won t make the playoffs but we ain t in the al basement that s the red sox position,0
not as bad as a former psyqo nigger that likes anime,1
some niggas didnt desrve to have that bitch in the first place,1
rt lets butt chug mikes hard lemonade,1
anyways never trust a bitch amp dont snitch unless you looking for some az and ditch,1
frankie is a twat,1
i think i need to see said bitch in question,1
rt on this the cry never again is absent and mocks our pledge to the fallen from ancient an,0
but i callin out da race card ain t no colored podcasts out dare,0
huh last games tampa balt yanks and they lost their best pitcher please explain your logic,0
but you bird ass niggas out here getting your feathers ruffled just shook and ain t no such thing as a half way crook,1
rt i occasionally go to play flappy bird and then i die before getting one and remember how much i hate it,0
glad i ain t got no bird legs,0
it is impossible for females to be players pimps etc they re called hoes,1
rt udonis talking some big trash to lance lebron holds him back,0
because she a typical ghetto girll,1
my goal for soccer this year is to get a yellow card every game,0
och hoe wonderbaarlijk dat jan het alweer met n marokkaanse bner aan de stok heeft na fatima lamyea tofik nu ook abdelka te min gevonden,0
oh well turns out that baby aint mine does jig,0
i traveled back in time to middle earth and crept up on my enemy i slit the hobbit s throat and by reflex vomited into my trembling hand,0
my bitch bruhhh,1
rt in herkenbaar hesje in je eigen buurt pleit er al jaren voor weet hoe bevreesd ik er ooit voor was da k er te wer,0
rt if your act like your those ages not like your its not cute that awk moment when i thought this tweet was abo,0
rows for the hoes curls for the girls planks for the skanks deep cuts for the sluts quads for the broads no pecs no sex,1
girls be like i love you babe lt hoe isn t that today,1
old hoes get mad when you don t show them the attention they want,1
rt when i was little i remember laying horrified in bed as hand puppets held a mock trial convicting me of putting my hand up th,0
dare be only one bag dat folks be suckin on what i comes to yo partayyyy all da ofay be wantin to ride in my eldorato,0
your so fucking retared its not even funny bitch im going to sleep u,1
rt wtf ling ling did you at least calculate the circumference when you threw that ass in a circle,1
niggah you gay,1
who needs an alarm when you have the worlds most annoying bird outside your window,0
and of course some rascally on the radio is blaming the dead az firefighters on oy vey,0
rt here s your first look at charlie cox as matt murdock in s on,0
rt these bitches aint shit amp pussy is my greatest vice i love smokin weed i hate advice,1
i ll ask you same question do you support border jumpers do you support illegals,0
rt lord rt rt rt if you a hoe you a hoe i m not finna sugar code it,1
amp amp hoes round here just opening legs like walmart doors,1
looked like you but at the same time looked like some biker bitch or punk rock bitch from a s movie,1
rt what i know you support killing babies mock the handicapped slept your way into harvard then ditched your hubby amp ki,0
faggot,1
without serge the bird chirps the sun burns the grass grows the world turns the moon glows the river flows but i die without serge,0
the draught horse,0
now my side bitch my main bitch bc my main hoe ain t feeling me no mo no mo,1
rt fasho you ve been officially hired as my bitch,1
gotta question the nicca standing next to you cut em off,1
good enough fag,1
that s where birds came from,0
rt seeee rt let that bitch hop in your mentions one more time hear,1
if the bitch don t like it she can t be my bitch,1
the little cunt can just die for all i care,1
also nack which autocorrect changed so i m putting my phone in the trash and going to sleep,0
rt for real this game is pub trash let s do drugs and get smashed,0
he s been drinking too much of that shitty canadian hoser beer,1
some niggas beat a bitch to get a point across some mentally fuck w her some just ignore it,1
rt when lil wayne said why give a bitch ya heart when she rather have a purse,1
rt i don t wanna hear sgt s name come outta the preezy s mouth he couldn t be bothered then keep his pie ho,0
ma am did you clear that tweet with the careful they may brand you race traitor for the nerve of thinking,0
stop sayin my gov name fuck wrong widd u bitch is u stupid,1
rt you d rather live with trash than make it work with a good woman,1
you always find something to bitch about,1
only if its yellow cake amp chocolate frosting,0
rt breaking louisville coach charlie strong is expected to accept texas job according to espn amp media reports,0
fucking queer,1
rt kik me ass hoes rt got an iphone but it s off ass bitches,1
happy hangover the resurrection is now complete,0
so you females feel like it s ok to dress like a hoe smh i just hope i don t have a daughter please god,1
thats just me rooting against a team i hate not banwagoning u retard u have a different favorite,1
real shit bro yo hoe told me if smoothie king had straws i ca fuck,1
look at that bitch right there right there,1
rt i have to pretend like i m a cold hearted bitch and cut you off in an instant without a second thought when actually i,1
salute a real nicca,1
karmas a bitch i guess you should of loved the old me,1
ohkay ma texas bitch keep textin me callin cryin stressin me bout where i been but i ve been with another bitch allegedly,1
rt well i play flappy bird now and i don t know why,0
why did they add your name all ghetto like that looks like they used label maker lol,0
aren t they the best there story is here now it s time to visit our yellow friends at,0
rt flappy bird is deep hahaha,0
me bitch,1
photo check for background spooks,0
march is about to get mad,0
need to start mcbob because williams only shoot let him play with bird,0
rt i m gonna start my own web md site and the only three diagnosis are quit being a pussy lay off the drugs call,1
hahahaha do it bitch make her fall in love should i,1
rt bae go text your hoes me,1
lmfaoooooo gay as fuck rt get these two faggots off my tl,1
ruley a bitch ry,1
i hate birds they just piss me off about the fact that i can t fly,0
rt twitter s home button is a birdhouse when you join you re an egg the logo is a bird most people don t realize this,0
rt goes into monkey bar to meet swingers,0
paybacks a bitch and bitch you ve been livin in debt with me,1
not a fan of her guess im the minority rt beyonc ratchet ass is trash rt you re the anti christ kfromtheg,1
cocoa puffs time bitch,1
chance is trash,0
rt how much coke did charlie sheen do enough to kill two and a half men i guess,0
when twitter rappers dm me their trash links,0
old fellas water froze in that funeral home he got it unthawed and wants me to help get his pump going again that place spooks me man boo,0
lmao bitches is crazy after reading the first sentence to yaself jus see how dumb you sound,1
his job as us prez to protect us is throw in trash ebola er at our cost daniel both money amp lives dog,0
rt how to get unlimited pussy in high school,1
they say numbers dont lie bitch im not the,1
chinese maverick we were communicating comrade u know giving the imperialist yanks the birdie,0
rt the world wouldn t be as fun if hoes didn t exist,1
look rich act poor and never trip over a bitch that ain t yours,1
the hitman holla vs charlie clips match up is bittersweet shit s gonna be cold cus hitman holla gonna work but it s his last battle,1
rt now let me write your mom since i have her address amp let her know her daughter is in miami selling pussy for,1
bruh youtube a bitch ass nigga bruh on me bruh,1
rt many lil bitty bitches,1
my mother raised a cunt lol,1
rt girl i know you got hoes me,1
half these bitches be playin because but im far from a lamee,1
ur a boss ass bitch,1
rt np big nig nig,0
and i believe we all evolved or whatnot but i find it hard to believe that we all came from apes,0
all i want is a million dollars and a bad bitch,1
rt rise of the planet of the apes,0
regular joes rockin tha boat that s us redneck yacht clubbb,0
bailey is gettin pussy,1
boooooooo that was trash,0
greatwhiteprivilege straight people are like can we all just be nice to each other and queer people are,1
kangaroo jac a bitch wit dry weave rt fuck i look like hoe,1
lmao you niggas regionally picky about hoes now just say anything on twitter makes it s fun tho,1
did we just become best friends with these hoes on the boat well probably so but we don t love em tho,1
i hope i trip and fall into some pussy tunechi,1
freezing my nips off out here,0
gator bait,0
now i m chewy high with a hard ass dick ooh there goes my pager could it be a trick bitch,1
rt seton catholic where their own students talk trash about how low of a division there football team is in,0
i never seen a asian or chinese bitch pregnant shit i throught they kids just spawn like call of duty,1
fuk wit a real nicca,1
looks ghetto as fuck,1
hoe i m at work til like,1
say it to me when i confront you pussy fuck,1
never keep leeches in your life if bitches take more than they give it s time to cut them off,1
fine i ll settle for an oreo milkshake,0
i wish didnt block me long ago for calling him a pussy so i could call him a pussy again and get blocked a second time,1
international law enforcement operation disrupts shylock banking malware pcworld international law enforcem,0
why does msnbc have a news show that is opinion amp right wing talking points joe the nation is with pbo not u teabaggers,0
when twitter rappers dm me their trash links,0
some jihadi posted a bio of the boss mr awad with excellent sociological info can t thank him her enough for the gift,0
there is no such rule as tie goes to the runner out or safe,0
rt there s too much groupie bitches hard to come across girls who aren t overly social and friendly with everyone,1
rt you might be a liberal if you continue to trash america claiming how horrible and evil it is yet you refuse to leave,0
charlie sheen,0
webbers rt sz vnds restorers dream cracked midsole sole separation and fogged bubbles,0
i have really light colored eyebrows naturally and it s not ok,0
stfu redneck white trash head ass,1
hi charlie,0
rt shy bladder group protests rob lowe directv ad,0
your second add just ruined it a new low picking on a cripple,0
rt bitch we rmp fuck who don t like i don t like,1
rt storybook ending in new york derek jeter walks off a winner at yankee stadium,0
that hoe skilled,1
posted a new song guala,0
rt main reason why i aint got no girl cause i aint never found not bitch who tryna get money wit me all y all hoes like,1
rt if a tree falls in the woods and nobody is around does it make any noise if nj blows away and only trash live the,0
if you decide to do damara you should make her a gladiola we have gorgeous rust colored ones coming up over here,0
smoke good weed with a bad bitch,1
rt messi is trash,0
rt highest score on flappy bird cant be beat,0
rt jody was really a pussy tho he let some lil niggas jump him and take his bike old head sonned him in front of his mama,1
ha booner has that twitter ha,0
some of y all bios are trash mine pretty good,0
you don t know what i know name somebody colder you monkey faced immigrant,1
rt where has this been all year but still,0
pussy,1
rt tiny jihadi,0
how do you have a beautiful female and still find a way to fuck w ratchet hoes i don t get it,1
i see ya big boi in the oreo v s,0
that s like saying i ve had the pinto since rt dude i ve had an iphone since the beginning,0
honestly the performers on there red carpet were trash hahahaahahahaha,0
im a proud wacko bird how bout you,0
rt two stocks to turn trash into cash,0
make yo bitch open her legs,1
last year i had to explain why queer theory is the acceptable academic term,0
rt bitch you got me i trouble i love you too take your drunk ass to sleept,1
rt p s up hoes down if ya bitch can t swim then tha hoe gone drown,1
rt basic tongue ring to suck dick with and a basic costume recipe for a hoe ready for work,1
late upload bitches,1
rt her being albino isn t the problem its that gut that hair and that fish net she decided to wear sooo many things wrong w,0
may the bird of paradise fly up your nose may an elephant caress you with his toes may your wife have runners u,0
rt snapchat got hacked all of you hoes about to have some explaining to do,1
giants secondary lookin like trash,0
rt i hate a bitch that think they crazy,1
what else come on on mondays im not finna watch that trash ive destroyed enuf brain cells,0
rt i can t stand no messy hoe true story,1
rt you ex bitches need to realize,1
they trying to hoe todd gurley johnny manziel signed them helmets and got off but suspend gurley the rest of season,0
good leave you stupid faggot,1
shylock amp wongs incidents of democrat bigotry in weeks media mum via,0
strong with the force leprechauns are,0
i saw so many basic bitches just picking up my school schedule i kinda wanted to throw up tbh,1
rt downloaded flappy bird minutes ago it s already deleted,0
edward did oss he sparkled bitch reality,1
lol there s a talking monkey live on the internet will wonders never cease,0
shut up bitch it looks smooth like a booty,1
who the hell is gonna buy your shit when your dirty panties and trash are clearly in the background of the picture,1
rt eat her pussy and look at her like,1
rt guys with colored eyes,0
luhv u tioo a drunk bitch lol,1
naw negro,1
rt what s going down pussies,1
i love how my brother actually tries to understand his girl and see her point of view when they argue instead of being a bitch about it,1
charlie looking like he s the one that made that,0
bitch go shoot some balls of paint ole hobby finding ass,1
man fuck these bitch ass niggas how y all doin,1
now works on fancy telephones so i am told i have a clam phone that i call mr clam that only texts and phones,0
note khorasan is the old arabic name for parts of iran afghanistan not an invention of modern jihadis,0
i ain t stressin you hoes know dat,1
charlie lapdance,0
won t catch me sneak dissing thats fo the birds,0
rt if i ve ever offended you im sorry that you re a sensitive lil bitch,1
rt i hope the yankees game doesn t get rained out tonight it s going to be a special atmosphere and game jeter deser,0
looks prime for some trash pick up,0
rt math,0
