clean_text,label
he does lmao rt sean payton been had hoes rt lol,1
should go to or that turned him into an ape no the major,0
started wit hanna montana hoes now im fuckin all of nick cannon hoes,1
somebody please bring out of my hotel room and hire me for something real gt i work hard for somebody throwing me in the trash,0
i just put down a pan of brownies,0
colored contacts in your eyes blinders on mine cause i can t see you at all lmao,0
blue sapphire earrings k yellow gold clip on diamond alexandra earrings in emerald crystal on emma,0
why you stressin bout a bitch,1
bitch it s going mo weeks,1
rt winston connects with greene on the slant across the middle for the score ball game is tied,0
i become more of a bitch day by day,1
these niggas rather love these hoes then get money smh what the fuck wrong with these niggas,1
dont fuck wit broke bitches,1
i took it harder when rivera retired i m not a yankee fan but i have a lot of love and respect for em especially the core,0
amp fuck your bitch,1
rt rt most trash halloween candy of all time don t debate me on this,0
just pulled out his pocket constitution bring it man just mocked mccain s wacko birds comment hahaha,0
naw i juss like making you a lil mad i have been gone for too long tho i hate the boonies,0
rt jealous bitch,1
people be so angry tonight on dis here tweeter it hard for a colored man to see all dis anger like bein in a waffle house in mississippi,0
mr president amp homeland security please ignore any foreign threats and focus your sole attention on our police force,0
in every cartoon theirs alway a saving these hoes lmao lmao damn captain saveahoe,1
rt hoe,1
it s the st century ladies spoil your man don t be a snotty stuck up bitch,1
rt stop forcing ya kids to take these pictures u trying to trap niggas online wit u funky hoes,1
rt bitch you got too many teeth in your mouth,1
dafuq is floppy bird,0
nigga said i woke up in a bed fulla bitches that i ain t een fuckin but idc his shit bout to be x harder,1
i heard green tea makes you lose weight and imma coon so that explains the watermelon,0
its brandon motherfucking reason he s a bitch nigga,1
big squawk q when will dfl dump ryan uncle tom winkler not going to happen berg bleat on proud,0
will be interesting to watch how interlagos grips in this weekend f cars basically the guinea pigs for wec later this month,0
birthday today bitches and i gotta work,1
if u eat fried eggs and leave the yolk entirely yellow ur a disgrace and also nasty,0
rt when will you guys leave that childish pussy alone get that sophisticated pussy,1
whoops bought snuggly hideous fuzzy boots because it s cold as balls all of a sudden,0
rt and rounding out our cnn ebola panel tonight the monkey from the film outbreak,0
your what s wrong with the white race you fuckin coon slaying piece of poop please die alone,1
you didn t even pass esl yet you bitch lmao,1
b c she likes black men and rap music huh lol rt in general she wants to be colored,0
aint no hoe in blood,1
it bothers me when a ugly girl has a bad bitch attitude,1
only tweet me if that pussy got superpowers,1
breathe rt you are going to kill yourself if you don t exhale rt killin you hoes,1
pierce would ve easily drained all these shots with us he s so trash now smh,0
god i cant fucking stand waiters who bitch about people not tipping get a real fucking job,1
rt bitches be begging for love amp loyalty when they ve never giving it to anyone karma bitch,1
rt babes we buy brazilian and peruvian not bengali,0
if u don t buy the box of colored goldfish you r a racist tbh,0
wtf is ur tumblr bitch,1
what an amazing proud day it was today for and time for bed good knight,0
do it do it you ll still e a fag but do it i ll pass heidi,1
rt main bitches saying i hate a send me a pic ass nigga be answering every single one of dj rice a roni s request,1
rt if i ve offended you i m very sorry that you re a lil bitch with no sense of humor,1
get some h agen dazs ice cream bars a whole lot make sure chocolate gotta have chocolate man some popcorn red popcorn graham crackers,0
i think its about trying to be the most what we in socal call wiggers,0
y all gots betta machinery fo dat hanger be ghetto,0
rt vintage mickey,0
i m not mad cuh hahaha suure tuku ho ita,0
damn i think your redskins lost,0
according to my brothers ipod its december if so i predict that mickey mantle of the ny yankees will announce his retirement march,0
cause i m tired of you big bitches coming for us skinny girls,1
nips,0
half of yall hoes anyways so the ones with thigh gaps get a friend without em have a nigga fuck yall both and ask him who got better pussy,1
rt i m snatching all your bitches at my leisuuuure,1
i eat dat chicken out your love box baby lovin a white woman while eatin chicken a colored mans dream,0
don t get me wrong g i d hunt birds but that s a lot of work amp well i just ain t that hungry,0
but bitches are crazy i d be in jail for sure,1
i was at my bf grandma house today goin through old albums and his grandpa had naked pics of his side hos from the s,1
how you just gon start some mess and try to break up that man home for racks i ll kill that hoe for breezy fam,1
brilliant job by to limp it back to the pits without causing a yellow wish he didn t need to though,0
and bullying i didn t know u could bully over the internet and the bitch came at me so idk why u in my mentions bruh,1
bitch foh,1
photo happy friday bitches,1
these new nigga hipster hypebeasts love all these faggot ass bright colors and nike keeps giving them what they want smh,1
been huntin hard and finally nailed her best wedding koozie i ve ever seen,0
even gtta ak sittn at my bitch house,1
rt before i betray them i slit my wrist,0
bad bitch with me and you kno that her ass is fat,1
may i jump in u ball less dick wad as a conservative feminist disabled vet bitch i wish u luck with a capital f,1
the girl skipping school ain t nothing but y o and just made me say in my head bitch u supposed to be in school had to catch myself,1
i need to pick between two wigs the agony my cute multi colored bob or my red stevie nicks curly one,0
everyone thinks that i m not the person on my id like look at my moles i don t understand like i colored my hair what a big difference,0
the heat will make you wanna put hands on a niggah,1
rt rt hell wrong with yall rt pecan pie and sweet potato pie trash,1
if my fade is perpetually fresher than yours that s a real ass bitch rite there,1
rt thursday we will see bitches dressed up like if the hallways were runways clown make up on some girls guys with pants belo,1
i hate when people tell me i have to many tattoos and they make me look ugly like bitch fuck you,1
rt derek jeter a class act a great yankee a st ballot hall of fame inductee to be,0
rt stop complaining about being single hoe we have bigger problems here rn like mcdonald s doesn t serve breakfast after,1
rt tiny girl can t trust a bitch named tameka no way,1
if you a top notch bitch lemme here you holler,1
marcus smart belongs on the celtics both trash it was destiny,0
he killed that hoe though,1
rt the stars wink knowingly and smile at each other when they see two lovers kissing on a secluded bridge on a balmy autumn nig,0
rt don t be a bitch to someone who can out bitch you,1
rt and she s watchin him with those eyes and she s makin him linguine amp clams with that body i just know it,0
i ont like no dramatic bitch so i just separate myself n shit,1
why do you guys cry and whine whenever someone says faggot it s ridiculous,1
rt i don t play about the monkey you have to earn this shit,1
rt i wanna eat weed brownies but then i ask my self if i really wanna spend countless hours watching a documentary on sea tu,0
rt your girl swear u cheating until u fuck a bitch for real then it s omg how could u,1
you ve been talking trash since we were and,0
cheated my way to get hahaha this bitch funny if youre so worried about me then stop subtweeting me dumb ass,1
lmao he left that bitch,1
i am a yankee by birth and lived much of my life in north i see no diff in level of racism,0
rt thanks for being black in darth and now years old you kinky hentai son of a bitch,1
walking dead gonna be so trash this season,0
rt don t trust these hoes,1
rt oreo ice cream cake,0
you bitch and complain about how bad our vets are being treated yet you are still willing to send them off to war sick idiot,1
trash show,0
the coon n coon wanna b got what they should have except should have been more time in jail,1
lashontae a bad bitch times,1
rt black bitches be like boy i told you not to get my hair wet,1
aye the part be treating the bitches too good,1
officials jihadi cockroaches now booking tickets on cruise ships to syria,0
nobody gives me a trophy cause i m old and colored,0
rt on this day february in waylon jennings left us for that honky tonk in the sky dreaming my dreams ht,0
rt rt if you d marry scarlett johansson,0
y all suck on flappy bird,0
you look like flappy bird,0
i didn t know that was a fad sounds fucking retarded haha,1
basic bitch no chill,1
leave it up to me it would ve been in the trash all of it,0
rt these bitches crazzzyyyyyy maaannnnn,1
golden oreos are the best,0
let me show you how that pussy work rt brian mcknight should have more accolades his music is everything everything,1
rt oreo ice cream cake,0
new show announced in lutsen mn at papa charlies on december,0
that was my mock done on a simulator check it out pick your team how many rounds and go for it,0
rt i m so hungry if someone would send me a flying parachute with brownies attached to it like they do in the hunger games tha,0
i have no respect for people who cheat that shits just retarded,1
them hoes are clean,0
there s a different between ya bitch a ya friends your bitch rey to build wit you your friends just tryna compete,1
rt the people of the ghetto are rising up and fighting back whose side are you on,0
what are you gonna do i ma chase you out the club like mobb deep did to you pussy,1
homemade pussy eating,1
my grandma got a rosta colored dress it s so pretty she better let me borrow it,0
translation for the slow he out saving hoes by rt out here saving lives,1
we re here at the opening serving free samples of cider vegan sliders brownies,0
rt fucking retarded question,1
rt it was all yellow,0
and you kno we the opposite of down bitch we up,1
happy birthday to my pops old negro spiritual is today lol,0
rt shannon said u hoes cant be wit the glo,1
rt i peep everything and just know i ll slap a bitch with a smile on my face,1
photos kate upton cheers on the yankees at last night s game,0
rt art thou the bird whom man loves bestthe pious bird with t scarlet breast our robin that leaves these summer winds sobbing,0
all jokes aside i m goin thru it a niggah heart hurt smh,1
typical bitch during a break up tweeting smfh,1
niggas talk more than bitches these days,1
you ah lien ass hoe,1
rt most common white people activities wearing tapout shooting up schools calling you a nigger on xbox,1
i get paid too chill share the wealth lil nicca,0
then you would ve died if you didn t breathe bitch,1
rt bitch you love every team but the us lol rt this is the game i ve been waiting for i sincerely love both of these,1
your a punk pussy ass bitch dude you don t have the balls to fight all you wanna do is wanna hit girls your a fuckin bitch,1
i got a measly followers on instagram that s probably why these bitches ain t takin me serious,1
kike your a soft nigga,1
rt lmao it will have a slope of x,0
rt if he asks what you about to do after y all get done fucking you a hoe,1
so yesterday i ran into a dude i went to high school with amp he used to be skinny as hell now omg same fucker who slit my tires years ago,1
rt rt on average but i can be an when need be on a scale of how ghetto are u,0
i actually get on with erin and think she s really nice bit you re so two faced and bitch about her all the time,1
once the brainwork is done on pacemakers at medical device companies they call in the contract tinker toy engineers like sc troll,0
i find a new song i like and play that hoe way more times than i should lol,1
rt i ve talked too much trash for ou to lose today,0
rt not a fucking charge even as a juvenile if you call a thug at this point just say nigger cuz it s,1
i don t know what you been told but i love them project hoes,0
rt don t tell a girl you ll never eat pussy cus you just lost that means all you do is have sex and you boring,1
rt just to settle it once and for all which came first the chicken or the egg the egg laid by a bird that was not a chicken,0
really craving my arroz con pollo y habichuelas right now,0
i love my amp but most days they remind me why birth control is important later in life i miss my baby bird come home,0
rt kill this beaner,1
sitting up here next to the neighborhood crazy bitch amp she keeps randomly busting out laughing,1
rt i d go crazy if these animals like them grabbed my mama like that i ain t going out like no bitch,1
niggas retarded lol,1
stupid freshman bitches that walk like slow as hell and u can t get around them hurry the fuck up sloth,1
rt i wish they made a hoe fax id be like show me the hoe fax before dateing a girl,1
this time a night dark skin niggas really turn into lightskin niggas i swear i seen a darkie try buying starbucks mins ago but they closed,1
lmfao watching brokeback mountain with taylor cuz we ve both never seen it aha,1
what is that monkey doing to those poor bottles,0
interesting,0
happy columbus day even likes and what the fuck is wrong with you fuckin,1
use to trap them birds now i m fly like a birdddd,0
rt recap in epic storybook ending derek jeter closes his last game in bronx with a,0
someone please bring me goldfish crackers,0
couldn t help it man niggas pussy for robbing a chick and shootin her,1
every spic cop in is loyal to the,1
rt every seth mcfarlene cartoon is trash yall love low iq comedy,0
sebastian is high on cat nip rn,0
my daughter makes me with i wasn t a hoe from age u on a roll tonight,1
seeing elder queer couples marry really is emotional they get to live their final years with equality and with dignity,1
rt ur fucking white trash,1
rt if you buy tickets for transformers d they just lock you in an aluminum trash can and toss you from an overpass into rus,0
rt ion like bitches that do slick shit just be straight up nd let me know wassup,1
it s the entire pats bandwagon they re faggots,1
so scared for orientation i hate meetin new people they re gonna think im this quiet girl but really im the craziest bitch they ll ever meet,1
with the birds i share this lonely view,0
rt charlie sheen engaged to porn star mens tips sex toy the adult toys,0
rt doing nothing as an agenda unbelievable that the dems failed to use that against the teabaggers,0
embrace it love it flip this group of mine runoff water colored turds off and make a pick,0
lmfaoooooo rt i m so glad my shorty ain t all over twitter and ig tryna be a famous columbus hoe,1
rt i don t care how much pussy i get i still got to jack my dick,1
derek jeter clap clap clapclapclap,0
reminds me of oreos lmao,0
nigor,0
i was informed about a bird pheonix today that i could not find a physical image of all paintings mythological or extinct,0
rt nov thanksgiving dinner pm proof on main a day being preoccupied with a giant bird in your,0
fuck you bitch,1
she sounded like a bird crowing,0
rt if she ever been on a club flyer she a hoe,1
twitpic a selfie with light colored eyes,0
yes i m white washed because i don t go around repping my hood and saying a bunch of ignorant nig terms,1
find a new hillbilly,0
rt so this is the woman who was a bird then turned into a woman from the sky in nigeria,0
rt so my homegirl fucked this alpha but little does she know she s just sloppy seconds how my pussy taste famu,1
i want it i love her gooks she is awesome where did you get it,0
yeah but sting was already a proven draw this is apples and oranges he signs people with the sole purpose of burying them,0
rt still the greatest tweet ever rt bitches run on emotion not logic a bitch will say if the number,1
i thought she was albino tho,0
good day honkies i said good day honkies,0
i m a boss ass bitch bitch bitch bitch bitch bitch bitch,1
rt charlie rose can you coexist with israel meshal not as occupiers after that national consensus will decide not ha,0
rt yall say why you dating lil girls like mature hoes just on a rampage outside,1
ight bitch ima see u,1
that night cap nonsense is for the birds,0
my bf loves crows thought he might enjoy the last tweet,0
michael pineda hides pine tar on his neck fact that the yankees cheat go red sox,0
yeah sorry monkey team just keeps kicking ppl waiting for muh pizza,0
well thank goodness i got other musicians that aren t bitches like for example,1
soo what you putting on those crackers gregg,0
someone tell his dreads are part of the uniform i d pull your hair too why are you trash talking cut your doodoo braids,0
rt skitdaddle wit that shit hoe,1
yes indeed camels ostriches and zebras sept,0
rt lmfao rt alco ho l,0
i knew a new orleans nig would say something crazy lol,1
bitch probably molly d the st nigga that said good mornin back to her,1
ewh bitch you look like an inbred,1
no a pop wop,0
rt that the yankees have won four straight shane greene starts and of speaks to his stability in a season of starters emergen,0
bitch i m done with school,1
rt good pussy will change your life,1
tuku ho idk blah blah blah,0
for real lil bitch,1
escort missions in games are universally trash,0
search the terms obama and twinkie and get a bunch of people rehashing the same handful of jokes while having no idea why hostess failed,1
rev charlie rangel what unions stand for are spiritual damn things like inflatable rats,0
rt victory outlast a s in innings eduardo nunez the hero and oh yeah first place still resides in the bronx,0
i still think he is a pussy haha,1
this bitch mentioned dr ruff i m done,1
rt ur a wack bitch who sells her pussy for lives with her mom then was homeless cut the lies,1
rt my inner nigger is coming out,1
malibus on a come up but in other news she mean denna hoe and not even light skinedddd hahaha,1
pay your taxes teabaggers,0
rt pity parties are trash amp i don t throw them,0
teabaggers weakening food and environmental regulations is infinitely more scary and lethal than terrorism,0
hey sir house nigger uncle tom aren t you from grand ole mississippi i rest my case,1
rt don t wife a hoe amp end up like these,1
a message for all of humanity charlie chaplin,0
fuck you pussy i made a mistake and started cj spiller over chris ivory this week fuck,1
but when its the same method other colonial states employed france england they dont get to bitch when its their playbook,1
rt on my mama yous a hoe omm yous a bitch omm if you get in a jam i bet you snitch omm,1
and i just cleaned the entire fucking weight room looked like a tornado went through this bitch c mon franklin,1
rt have a great day you lovely fellow apes,0
rt a penis lives a sad life his hair is a mess his family is nuts neighbor is an asshole best friend is a pussy and owne,1
get my name tatted right by ya pussy,1
rt for a hdm everybody block bitches too,1
what s a trash party,0
bitches think they re slick but no matter how hard they try and hide it we can still tell if they re hoes or not,1
rt if i cut all my hoes off for u amp we stop talkin you owe me some new hoes fym,1
polite yet militant,0
girls that wear colored jeans,0
a homeless dog living in a trash pile gets rescued and then does something amazing please share via,0
if you ballin then buy ya bitch something,1
these bitches love soda,1
naw she not a hoe she just a freeky girl,1
rt autographed photo of babe ruth and lou gehrig new york yankees,0
oh yahweh your hand is upon me your shadow hovers over me for your sake the house of ysrah al mock me all day long,0
when you open your starburst candy and get yellows lmao bruh,0
rt hoes have no life,1
rt she s really nice when you get to know her she s a bitch but you ll get used to it,1
rt amp i are discussing our awful s fashion choices yellow overall shorts boxers over leggings what was your bes,0
you should probably go clean your nasty pussy and not worry about wtf i m doing,1
these bitches love sodaa,1
rt love birds,0
he may be the president but that doesn t necessarily mean he s in the sole position of power in regard to making such decisions,0
like bitch,1
jj watt was on his grown man shit all night now let s get it,1
rt he loves me eats a brownie he loves me not eats a brownie,0
my father was born in nanticoke and attended lehigh i m a ct yankee but love the pennsylvania dutch cooking,0
best asian massage on the park slope top rated spa,0
i still can t understand why we don t dump our trash in the ocean it s pretty big and it d surely be cheaper than launching it into space,0
because she s a nigger,1
big red and fat squaw lol my hubby is so funny,0
just saw a crow gallop across the road,0
that hoe that you in love with that s that hoe i mess around with,1
this music is trash,0
that ain t bro moves that s hoe moves,1
you don t know me but i m your bra rt doobie brothers member michael mcdonald says he ll come out as a tranny,1
rt i hate when bitches brag bout how they bf put it down then they single,1
yall defense too trash for that,0
ok chill love bird lol,0
rt lt not buying bitches vehicles,1
rt if you don t like my tweets with my belief in jesus christ please respect it but don t mock it or make negative remarks,0
denzel did his mf thang in his new movie boy i swear oml he played the shit outta that bitch had me in the movies ready to be a killer,1
rip plate brownies large tea fries beans potato salad poboy,0
charlie is an ol hatin fool,1
jus need my nig mack wilds to win fk the award tho,1
rt on mammas ig aint ready for ma s i got sum bad bitches up ma sleeve boi lol magician ass nigga lmao,1
rt damn i hate a bitch that like to argue and shit,1
so cold ma nig,1
i am a celestial body hello,0
fat ass inbred rednecks like paula deen are breed that are going extinct i mean look at that woman i would hate to be her scale,1
ovo amp kendrick lamar still trash,0
twitter is like the friend i sometimes forget to visit and then he calls and acts like a bitchy mcbitcherson with a side of bitch,1
there is a time amp a place decaf coffee never amp in the trash humor via amp,0
a hour you re home and chillin and i m working pussy,1
fuck hostess to liquidate if bakers strike continues through thursday end of twinkies,1
you owe two hoe i don t wanna hear shit when i hyu,1
rt if you posted a thunder buddy status yesterday slap yourself your a basic bitch,1
hey why dont u get involved in black on black situations cause hate whitey b honest now,0
so sterling bitch gotta he a hoe aye she paid and you re mad dont blame the bitch she half black,1
rt liberals threaten my life everyday on here so don t mind me while i m a total jackass to their butt hurt pussies right,1
rt could you please refrain from being a dumb bitch,1
let this white boy be ghetto,0
a video an entire media will likely mock i am such a crybaby,0
bout to ride my horse to come fuck yo bitch ooh em tho,1
my grandma threw out all of my raps ones i made from th grade to now i m literally crying thats all my work in the trash,0
tranny,0
rt charlie wears women s clothing,0
rt i got gatorades twinkies rice puddings pringles and cookies,0
this is a true ride or die bitch what the fuck hahahahah,1
it s also a bird a city and a math theorem i make no assumptions,0
rt when you have a good girl say no to hoes,1
so some pussy don t cream when they cum,1
the giants trash,0
rt analyzing the impact of masahiro tanaka on daily brought to you by,0
my arguement with she s the baddest white girl is she s trash her argurment with she s trash is but she s paid,0
yuhh i m finna hit that hoe,1
my head too big for snapbacks i like beanies better anyway,0
sources say that charlie crist is on the phone with rick scott as i type this to concede,0
one mans trash is another mans treasure,0
oh my phone is some trash but you knew that,0
my cousin bio on her instagram light skin dark skin brown skin bitches holla at me she funny as hell,1
i was heartbroken tx inniz ho lmao haha naw chill you the one laughing at vdawg,1
grand opening top class oriental massage perfect,0
i m going to dress up as trash for halloween oh wait i look like that everyday,0
the way i fuck her you would think i love this bitch,1
rt last name sinner first name imma like ur pancakes in tha mornin he got u covered like aunt jemima,0
it s hard getting a bitch from the hood to suck your dick on camera she swear everybody knows her and she hates the light,1
what smdh another bitch,1
because hoes disguise themselves as real women,1
rt low turnout reported but charlie crist just filed and emergency motion to extend voting hours in broward co,0
are you a pig or are you a bird,0
you a oreo cookie now,0
yes why protest about sexism then go right home and beg for a guy to beat your pussy up im lost at times,1
rt what was that you tweeted i can t concentrate enough to read it over all your sad looking boob and pussy pics men prob,1
hmm rt every bitch i fucked wit is a hoe never met a real female in my life,1
rt how quick your bitch will text another nigga whens shes mad at you,1
bad bitches only,1
rt new avi thanks to b oreo,0
bang that s a trust worthy bitch,1
yeah man he even scare me and i is a nigger,1
bitch would rather fuck a poster damn thats cold,1
none here chantel lol rt there has got to be some hoes water s edge is too big for there not to be any,1
the early bearded man gets the clam,0
he said get up bitch that s not pg,1
all you ofay got left is da oscars better enjoy dat before us colored folk get dat too,1
first jig of the night,0
dallas hoe rt why,0
generate ascii boxes with nodejs all i see is the ability to bring flappy bird in node via ascii tubes and bird,0
