clean_text,label
your opinion plz when election over will there be any improvement or will bo still be allowed to trash america,0
rt with his bitch ass buut thaats bae kinda lol,1
it s definitely a bitch everything in life is ruled by money such a moral heartbreak,1
rt chicago will not refund million made from red light tickets issued after yellow lights were shortened,0
sorry sam i went to rt is wes durham woody durham son if so why is that tar baby doing a pack game,0
hmu talmbout match but when i pull up its other niccas wit ya,0
rt use what talent you possess the woods would be very silent if no birds sang except those that sang best,0
victor amp shawn legs don t hurt they jigg every damn night,1
rt attention leggings ain t for everybody especially you hippo looking hoes,1
yeah we know about anglo american principles,0
rt are you justin beiber because your a fucken gay cunt,1
lt lt lt when it s yellow outside,0
don t be a bitch,1
rt oreo ice cream,0
rt lol when bitches tryna chill with me like do u kno who i am im the mother fuxin dory hoe i touched the butt,1
this re colored pictured of abraham lincoln is one of the coolest things i ve seen in a while,0
don t tell the dumb hoes that,1
all these bitches want love from scrappy,1
in the fashion world urban means stolen from black people its ghetto on us and urban on them haha,0
lol ooop qt you little twats,1
thinking about the boom boom boom waaay ho video makes me laugh at least once a day,0
up like an eagle tryna catch the early bird that catches the worm,0
rt pink albino dolphins are extremely rare but do exist in the wild,0
bored then a hoe in the auditorium hmu,1
dawg rt man this about to be another trash thursday night game,0
i popped a molly every day last year,1
aye a nicca is tired tho,0
this bitch has two jobs and is starting school on the th,1
real basketball players get disappointed when they throw something in the trash can and miss,0
rt how to get bitches,1
i couldn t care less about these bitches,1
bitch looks like spongebob,1
one thing about it i m a loyal a nicca,1
rt all talk blahblah bye bitch,1
i realized it s the one on link s awakening too so you killed two birds with one stone unless you re getting the wind fish too,0
it s dumb cunts like you that make me sad to have served in a war so you wouldn t have to,1
if im trash ur trash since we baes now,0
rt just a bunch of rednecks hammered for three straight days,1
rt i m such a sarcastic bitch its beautiful,1
rt where these bitches at,1
when rappers say twat it makes me feel weird,0
you ever seen a fine eskimo bitch i m in google images looking them up now,1
fuck this i need a fat bitch these skinny bitches ain t hungry for da mula hahaha,1
cut up porkchop canned pinto beans a small can of carrots can of corn celery a potato cayenne powder crushed red pepper,0
rt meet me and my bitches,1
rt brendon urie must make other boys feel like trash,0
lol ike turner,0
he gets this bratty attitude from brittany and its for the birds,0
dayum saterlyt shoz un bayg ho ul,0
we raided nicki s wig closet for the summer bad gals just wanna have fun this bitch has the a nerve smh,0
having a blast yesterday she even had me on the monkey bars tryna kill myself lol,0
i ain t really trippin about the money yo that shit constantly comes like a bitch pussy,1
coon rt lt fills coffee up halfway gt lt uses irish cremes to fill other half gt,0
nba handle your zebras,0
you should have to be over foot and lbs to buy a truck we know most of you get em cause you re scrawny country pussies,1
fucking coon,1
wait a minute bowyer causing a yellow in a chase race rt caution,0
rt oregon state wr is a popular pick in recent mock drafts draft tracker,0
dislike people who bitch about other people being in relationships dislike people who bitch about people being single,1
rt ik vraag me al maanden af hoe de nl pers zich als een stel hoeren is gaan ge,0
u lost puppies dont know shit leave them niggers alone u can learn something besides how they like,1
rt happy th birthday to my main hoe and partner in crime,1
rt cue the liberal left s uncle tom attacks against tim scott in,0
john mccain trashes jay carny live on cnn,0
y all be cool out there in that cold chasing them hoes,1
rt that pointy nail game is for da birds,0
with birds ill share this lonely view,0
done for the yankees,0
or as i like to put it looking through race colored glasses,0
rt beautiful smiles and colored eyes,0
eating a roasted potato and smiling till my cheeks are sore the crow sfx in this cape crisis are super great,0
where does that fucking muzzie edict come from feds or prov govt s,1
blue cheese crackers intrigues and repulses me at the same time,0
i have never actually seen a yellow duck,0
holy shit i am just getting dunked on by a cripple this is unreal,1
that ugly ass picture and thanks bitch,1
insecure much put all you insults in one tweet fucking dumbass dude i d wreck you you faggot,1
rt i have sex with a lot of guys but i m not a hoe and i can sell crack to people and not be a drug dealer foh hoe,1
rt if or don t know you then you are not welcome on saturday bitches,1
when jake from state farm keep calling yo bitch but yall got progressive,1
only a couple of red sox have gotten past first base i m dying laughing maybe the yanks need to teach them some game,0
rt also as part of my release day gift yes we get those this adorable bumblebee bear,0
a hoe gonna be a hoe regardless,1
rt this bitch on maury a thug,1
tim tebow got cut from every team he was on in the nfl and he already got more hoes than me in starkville smh,1
pussy,1
mixtape sell sole got some bangers,0
diet coke trash,0
twitter is not a source of news broadcast you fucking retards it is when nbc abc cnn fox etc are all keeping quiet,1
can someone get me cheese and crackers,0
i love white noise and love delillo i ve resisted reading house of leaves for years it mocks me on my shelf,0
your a queer,1
i cannot express how infinitely better the book is to this trash,0
just noticed some trash on my notification page i had to clean up,0
rt yall stay tracking pussy miles but refuse to put any effort into controlling your own peen but okay i guess whatever ke,1
swag killed the bitch like columbine,1
just fuckin roasted this faggot,1
my side bitch is my main bitch cuz my main bitch aint feelin me nomo nomo,1
lol colored contacts played out,0
rt she a dumb bitch smh,1
the kfan mock draft continues cleveland is on the clock paul allen has the vikings th pick i am going with def back justin gilbert,0
the people who work at those companies tend to be trash,0
noap not taking them rt maca root pills making my vagina do the wop,0
shy glizzy feat plies free tha gang,0
at pussy cat lounge killin it with my girlz and,0
pussy,1
i wanna cut my hair but i m too busy being a bitch about it,1
freak hoes,1
rt i hate a always wanna smoke but aint got no money as nigga bitch like bye falisha,1
this shit right here nigguh,1
an inning and a half away from alex rodriguez being eligible to play just a thought omg feel an ulcer,0
i was playing music in the kitchen and now my mom keeps asking tony why give a bitch your heart when she rather have a purse,1
this my dog telling me he is done playing frisbee for now lazy mutt,0
my pits be stankin from doin dem flows is hard on a ol colored body in da heat dem white women be pushy when day want dare flows fixed,0
sounded like a bitch but whatever,1
well they re hoes no one expects them to be loyal,1
why they playing trash on espn right now,0
being single and not texting no bitches late night almost wacker than coming home after the club drunk and fuckin your girlfriend,1
bitches be in they feelings to much like live bitch,1
check his hoe for i check her,1
gucci mane on a bitch,1
money hoes and clothes,0
lol i will be there in the morning hoe,1
negative slopes aka a chart of my grades in math,0
just remember to keep the skirt dark colored it camouflages all that pan dimensional gore,0
rt the radio is trash,0
too pretty not to pretty jeezus my redneck education is showing,0
bitch gotta work all hard to clean that shit without ripping her skin lmaosjdusubejs,1
uncle tom hypocrite,1
rt dudes probably just think eating pussy is sucking on pussy lips fse cut it out,1
fairy tale hat free crochet pattern for child and adult at,0
rt buy me double stuffed oreos and you can be my boyfriend,0
rt win final score,0
jets trash,0
rt free the squaddd we in this bitch solid first block freee us,1
fantastic ready for tomorrow s sweep of the disposed o s ever except this month,0
rt apologies trash what s understood ain t gotta be explained,0
rt drawing myself an organic powdered goats milk bath with rose petals and chopped clams eww what just kidding it s mr bubbl,0
my sex game better than yo ex niggah,1
rt ray j is the perfect example of what happens when you give a lame nigga some pussy,1
when robinson cano left the yankees they were selling his jersey for when aaron hernandez went to jail they sold his for,0
best asian massage on the park slope top rated spa,0
con t also provide colored stickers to place on the nametags so that members can indicate their preferred pronouns,0
what a smelly hater bitch,1
lol find a redneck from oakleaf to take you,0
egg nog taste like what bird doodoo look like,0
mom heard a song about some guy with bitches and a long something or other so he could fuck the world for hours or something lolol,1
haha monkey feet i like it but real feet are magical on a back it smoothes every nook and cranny of tightness,0
lol bitches aint shit,1
god bless the dumb niggas who trust these hoes,1
rt saying who cares comes from a privileged position may you never experience what a queer person goes through and may,1
boy these downlow niccas should be ashamed,1
rt don t talk behind my back i hate that pussy shit,1
seriously if you re living at someone s place for free the least you could do is help keep it clean,1
was like blocked bitch don t start they are blocking us in,1
i got dirty birds hey shoot like larry bird hey,0
f u tumblr bc my blog is black amp white but there s so many great colored things i could reblog fml,0
never seen purple bird poop until today lol,0
rt ill advised slant call there,0
shit is fucking retarded no one wants to see this shit,1
rt so i took a pictures with him and he ate all the brownies i made but he s the new homie,0
them quicc to blast bitches them all about the cash bitches,1
rt a year old girl once struck out babe ruth and lou gehrig back to back and was banned from baseball for it,0
rt last time auditions came to dublin i auditioned and and a man in a blue monkey s,0
rt i would rather fuck a fat chick than allow a nigger into my house,1
lol i got rose been dat nicca tho never forget lol yee i was trippin,1
and who said i didn t like myself where the fuck u got shit from u made that up stfu and stop assuming and bitch am not ugly,1
g s up hos down rush i mean clearly he likes to party,1
i never get on twitter but when i do i get in bitch fights with niggas not even females bruh,1
paceys just told me about how flash was touching himself and he was turning yellow and black,0
ill find a cute hoosier to date next year,0
bread in general aint too good for ya but honky bread the worst,0
rt water is wet rt nike dc is trash,1
i get so deep in that pussy i touch the back of her soul,1
rt i thank every broad in the universe who takes that step forward amp puts colored contacts in her eyes that s one less person,0
cookies and crackers aren t even on the same level,0
brah wiz cheated she had hair like a dyke uh duh,0
rt lmaooooooo rt ayo take this pic for me fam you think the bitches gon fuck with this pic,1
rt drinking to the last drop washing teapot,0
rt gov rick scott refuses to debate charlie crist because of a small fan,0
sorry wrong bitch,1
some guy at orientation got asked what his top favorite music artists are and the first thing this bitch said was usher,1
foto imapython bieg albino sea turtle i think u mean soul of the ocean,0
stuffed her like an oreo,1
so was chris brown talking bout hisself when he said these hoes ain t loyal,1
rt me too defiantly going to see that new planet of the apes tonight,0
beyonc more of a hipster bitch wit no hips these days,1
ugh that crazy bitch in the crucible smh,1
if u get mad or in ur feelings bout zoe s vs yanks tweets then twitter ain t for u i be rolling at this shit tho,1
i was flying down the slope and just rammed into this small asian boy kid got up like a champ and walked it off,0
what ever happened to the teen titans of my day and why must they mock me with this teen titans go,0
y all i m so mad i wasted them calories on that honey bun that ho was dry as hell,1
how original you faggots,1
scandal a negro bed wench s fairy tale and propaganda via a must see for hebrew daughters of zion,1
hahahaa so people can t parent differently twitter is fuckin trash ahahahha,1
lmao the shovel video is pretty awesome she went down like a ton of bricks lol gotta love honky riff raff savages that is all,0
this store is so redneck,0
rt i hate when ppl say hoes aren t loyal they supposed to be,1
fuck niggah add it up gt gt gt,1
funny thing is it s not just the people doing it it s the people who seeing these pics and judging the birds just as wrong,0
meatloaf cream potatoes deer steak and gravy pinto beans and cornbread pear cobbler n bread pudding fhc,0
that one drunk white bitch that always instigate problems involving at least one black dude then crys afterwards when someone gets hurt,1
rt what i really want is some brownies from h amp r iced latte my boy and a blanket w movies that sounds prettttttty amazi,0
he don t even follow his bitch,1
dooms rt white nubuck or leather for the upper of the foam makes them a pass to me white soles too,0
bats are cool as hell because they re basically half tiny fox half leather bird,0
rt it s settled the ding dong is far superior than the twinkie,0
rt a list of mythical creatures jackelope phoenix griffin fairy unicorn pegasus a woman that knows where she wants to,0
rt pick one the girl behind the bar who ain t being a hoe,1
rt just because you not official doesnt mean you can act like complete trash and be free from acting like a decent human being,0
video on the record charlie baker,0
does da n mean negro,1
the boy who shot albino deer,0
fat hoes need a treadmill lol hmu therealwesjames com,1
the birds and the bugs by anat r via,0
one thing i always tell my lor cousins big cousins my bitches amp amp niggah u always gonna be good regardless,1
i wan do a mixtape pussy an cinnamon rolls,1
nothing says fashion like a cunt hat,1
rt i rather my girl be clingy than a hoe,1
lol youre retarded,1
dont make direct eye contact with anything birds cats nothing lol rt i m going out west to bu,0
when mary asked him about it said the part you eat is white you throw the yellow away,0
they need to stop picking up ufcs trash though and build up there own fighters more,0
egypt r the muzzie bros still running things only a tad better certainly no respectors of dem though,0
elza m jones was whipppppppen and drifting last night lol we was tu this ma niggah,1
if you must call me a cracker please call me a cheez it not a saltine,0
we gunna laff at chava rubio beaner supporters in a min,0
rt and i thought i had a problem,0
fuck a hot head pussy i gt a cold heart,1
cousin why is there a bird on your screen me it s twitter cousin i poke you me that s facebook,0
rt poll florida governor rick scott is leading charlie crist by five points,0
bitch your unknown u dont have a mixtape and you damn sure cant rap u couldn t rap if your life depend on it,1
racist tx trash enjoy your high along with gop win a substitute for racist loss,0
rt dat shit trash a shirt inspired by s emoji tattoo pre order now,1
wow rt so this is why big titties were slandered today u bitch rt stop the bullshit,1
sex should be a reward in a relationship nigga has never done anything for you whatsoever yet you still give him the pussy smh,1
no matter how much you bitch and complain america is in better shape to how obama found it period,1
rt does anyone know of a good pet sitter in northeast ohio specifically cats amp birds thanks,0
rt my bro made out with an ugly chick at a festival while drunk so now he s known as larry bird because he hits threes,0
money hungry hoes they can never get a crumb,0
rt i love when the birds are chirping in the morning,0
why even get pregnant by someone that isn t an never will be fit to be a dad smh stupid stupid hoes,1
rt i don t understand how so many americans can hate on obama for saluting with a latte nobody tells these swagfags anything abo,1
omgggggggggg mila kunis is so fing hot f sarah marshall she s like a bird anorexic,0
i was bout to smack a bitch,1
bitches be screaming fuck they nigga but get mad when another bitch fuck they nigga,1
isis supporters in america the jihadis next door,0
about to smack some peckerwoods in a judge pit,1
bitch watch tf out u on moose meat now,1
so far i ve only seen bad bitches talkn bout mansion lan wtf is up,1
she prolly got some bomb pussy too lol i hope haha,1
do you know how good ho ho s are at am answers you haven t given up all your ho ho s whoa,0
rt your sole purpose is to make money otherwise you d suggest violence prevention policies that actually work,0
rt welp rt the prettier bitch usually loses lol this is science,1
have they seen planet of the apes brazil has the highest number of monkey species of any nation in the world with,0
rt lmfao oh nah she keep it three hunna twitpic a selfie if u a ho,0
green beans summer yellow squash zucchini cucumber i will set some more out by the road today its free,0
yasss brownies amp ice cream,0
rt magnus the team leader was particularly rude and unhelpful as opposed to charlie who just blatantly lied awful service,0
remember when i told yall bout my coworker not lookin out a couple weeks back karma s a hoe got his ass,1
rt come on yankees lets keep this game going we must win,0
i like the yankees toinight,0
turn on the magic of colored light,0
bird shit aint no joke,1
we can t call somebody wack we got raymond felton rt lin so trash,0
y all wake tf up y all are pussies it s summer time turn tf up,1
what up fake ass hoe i m not gone fought you today gimme my nigga hand back,1
thank you charlie,0
rt never trippin on no hoes,1
fake pics get off my tl u r dismissed muzzie,0
eagles fans dont except the fact that mcoy been trash this year and that everybody figured out that spread offense,0
i ate a monkey,0
stop lettin them messy hoes mess with your business,1
video charlie baker remembers tom menino,0
everyone is talking about lebron james or the voice and i m just here eating cream filling out of oreos,0
rt fear mongering by the left is dying wake up who are you going believe charlie rangel and hussein or mia love and c,0
a teen was running around target in monkey pjs screaming oo oo ah ah amp the fitting room girls were cackling was today designed to annoy me,0
where s all my bitches where did they goooo,1
who wants to get there nose in these bad bois then hot sox and legs,0
killin in tekken lies you trash,1
they are little bitches when they are proven wrong,1
a bright neon yellow gauntlet,0
rt rt ao got bitches at home scrolling ig like,1
rt bitch be working and keep singing like she ain t never bust a move,1
thank you charlie happy thursday,0
great lead battle and then ricky hits danica for a yellow oh boy,0
i really wish i owned a rocket launcher to use on every retard driving in front of me today,1
the guinea fowls are not what they seem,0
rt charlie rangel on gop they believe slavery isn t over rangel is a flagrant tax evader and racist,0
rt rick scott refuses to appear on debate stage because charlie crist has an illegal electronic fan via,0
im so happy in the morning after i shave my pussy cuteness always sets me up for a good day u need some dick,1
who remembers when we were in middle school high school and would throw paper in the trash from our seat and yell kobe lmfaoooo,0
rt i don t tell bitches i show bitches,1
fags god damn,1
looking back i liked colored better let s go back to that,0
bt feat tori amos blue skies radio edit on,0
damn i use to be a big fan of ronda but so far she s been a big cunt,1
this hoe taken by the world smh,1
i honesty think the internet is just full of retards,1
ugly dyke,1
oh man this could be a serious first ever chanel bag contender rt grape colored chanel bags,0
me and this song bird sang in the same hs gospel choir,0
rt what you see is what you get i m a guy with a love of adventure and a need for speed charlie brown,0
rt getting the field ready for today s game,0
lt lt closet muzzie,0
leg day made me it s bitch,1
drugs gt is why are losing just ask and the hedge bet fund gt,0
picture time outside of metro fucking fags,1
i may have just cried a tad shiner,0
fuck wit us and we tweakin hoe,1
dat bitch a thot,1
pimps up pimps up hoes down future voice,1
rt i don t care how pretty you are if your personality is trash men are going to treat you accordingly that s not tru,0
rt tell him that you chose a not to trash the environment while trying to save it like a hypocritical douc,0
rt in which i refresh dhimmi seattle mayor ed murray s poor memory of city s long history as a jihadi breeding ground gt h,0
dude said ice jj fish created player on k retarded too lol,1
boy i had no idea that was coming it s called a smartphone you re horrible at trash talk,0
if you got a problem with me bring it up with me before i tense up on yo bitch ass,1
holy shit freddie highmore was in charlie and the chocolate factory me rolls on the floor laughing,1
good bitch,1
yeah she s a real pom maven,0
gum drop looking bitch commenting on peoples looks,1
yankees beat then in the grapefruit league the other day,0
is on bravo quality trash,0
bro i heard slaughter songs they all trash they just freestylers,0
i was in love with charlie,0
jacob u look like a monkey in dis,0
rt hun i m quitting my job and going to learn to become a psychic now i know what you re thinking well not yet i m going to,0
ha i m actually going to see a yankee game as weird as it sounds my uncle s house in nj is an hour away,0
rt saying bitch after proving your point,1
me and my bitch song,1
charlie and ron has constantly put out heat for their entire careers,0
rt fec may yank st amendment guards for drudge rest of internet,0
ain t say it s wrong but it s just as stupid as hoes showing up to get attention from dudes no one is bigger than the game,1
it s awesome when people you ve known for years talk trash about you behind your back and then ask you for favors later truly awesome,0
rt big night at wcvb martha coakley charlie baker debate here at bruins minnesota wild world series game,0
ima show my ass tonight i can feel it omgggg i was thinking the same shit bitch,1
me you don t even lift pussy,1
julie tell them crybaby blacks to get someone blk and dress them up white faced niggers always whining,1
yes amp no rt is it ok to beat a bitch up over some tweets or nah,1
thanks for ignoring my texts fag,1
rt id rather be your niggah,1
rt lol i m litetally just a walking trash can,0
nee dat is na langdurig gepest worden zoals ik al zei in d kiem smoren is ook vb voor t kind hoe je moet optreden,0
nigga byeeeee lmfao i ll be dammed if a fag stole my girl,1
just as trash as the others fixed none of my issues rt naw rt anyone download ios yet,0
how long after the redskins change their nsme will all memorabilia w redskind name be deemef racist and therefore illegal any thoughts,0
rt u famous niggas ruined the game by jacking up the price on the pussy michael paul budden,1
rt taking out the trash at night,0
floppy bird chalmers over here taking after his hero lebron,0
he a hoe fa that rt incredible vagina is rarely ever attached to an incredible woman god has a weird sense of humor,1
if i don t like that hoe i turn her ass into a frisbee,1
cutler less skill at qb than a retarded quadriplegic,1
idgaf about you regardless bitch you got me all day,1
pretty girls wit bird brains what a waste smh,0
i m tough ambitious and i know exactly what i want if that makes me a bitch then okay,1
rt twitter has a bird as its logo that s why when you join you re an egg and your home button is a birdhouse why am i,0
that would be the stunt in which crossed some water dressed as a dead man while his teabagger sheriff friend watched him,0
rt y these niggas on this hoe shit,1
today is fun but tuesday will be awesome v,0
saw pick up a dime off the floor with her toes apparently my monkey toes gene is strong with that one,0
all these ratchet bitches killin gossip girl,1
same hoes is still at it i should ve known,1
it didnt open das y i asked cus i thought yu ate wat i had pork chops yellow rice n beans,0
enjoying my bed just perfect for me my teddy bear and monkey it,0
rt i like good weed amp bad bitches dat can roll it up,1
pussy it s science donaire via rachel spelling error,0
rt bae will always be bae even when bae is not bae that s still bae therefore you hoes can move around please,1
don t be a broke hoe hating on a paid hoe,1
haha yolo did ya hit that hoe,1
rt top notch bitch hair down to her ass,1
please be a little depressed bitch the entire time,1
have her learn the first seconds of flesh and the power it holds death that riff would be cool for a bird to do lol,0
i hate pumpkin flavored items you other white bitches are crazy they re nasty,1
lets go,0
rt i play soccer cheat on girls and wear khaki coloured cargos haircut,1
rt quan helps everyone out with random questions and computer stuff but no one can oop him grs something ain t right abo,0
what happen to them vixen ent bitches they got ran and threw to the side like a foothill bitch,1
rt when you re in public with your side hoe,1
rt niggas be waiting for these light skin bitches to respond to a dm like,1
